{
  "$schema": "https://json-schema.org/draft/2020-12/schema",
  "title": "Image Team Engine Capabilities",
  "type": "object",
  "properties": {
    "engine": { "type": "string" },
    "path": { "type": "string" },
    "runnable": { "type": "boolean" },
    "api": { "type": "boolean" },
    "txt2img": { "type": "boolean" },
    "img2img": { "type": "boolean" },
    "inpainting": { "type": "boolean" },
    "outpainting": { "type": "boolean" },
    "instantid": { "type": "boolean" },
    "pulid": { "type": "boolean" },
    "photomaker": { "type": "boolean" },
    "notes": { "type": "array", "items": { "type": "string" } }
  },
  "required": ["engine","path","runnable"]
}
